{
  "$schema": "https://json-schema.org/draft/2020-12/schema",
  "$id": "https://crypto-quant.local/schemas/challenger-episode-cohort-plan-v1.schema.json",
  "title": "Challenger Episode Confirmatory Cohort Plan",
  "type": "object",
  "additionalProperties": false,
  "required": [
    "$schema",
    "schema_version",
    "plan_id",
    "plan_hash",
    "registered_at",
    "design_commit",
    "package_baseline",
    "known_pilot",
    "trial_binding",
    "cohort",
    "measurement_binding",
    "stopping_policy",
    "reporting_policy",
    "ai_policy",
    "status",
    "authority",
    "eligibility",
    "warnings"
  ],
  "properties": {
    "$schema": {"const": "./challenger-episode-cohort-plan-v1.schema.json"},
    "schema_version": {"const": "1.0.0"},
    "plan_id": {
      "type": "string",
      "pattern": "^challenger_episode_cohort_plan_[0-9a-f]{64}$"
    },
    "plan_hash": {"$ref": "#/$defs/hash"},
    "registered_at": {"const": "2026-07-30T09:10:00.000Z"},
    "design_commit": {"const": "9083bf5"},
    "package_baseline": {"const": "0.42.0"},
    "known_pilot": {
      "const": {
        "role": "EXPOSED_PILOT_MANDATORY_ALL_STREAM",
        "result_id": "challenger_episode_economic_result_8f2b70abf6221dc2531ecd9e6b4ada9732e8775d9673b67d4865fe7fa9b18723",
        "result_hash": "2ac4e92fa32c3841548c433590cda3fea799702fdcda291d25866db2bd993fc4",
        "result_file_sha256": "8627677275c31de573f1a59f638ba1678772115dc6d932027a36e2f8b62d9fee",
        "entry_scheduled_for": "2026-07-29T00:00:00.000Z",
        "exit_scheduled_for": "2026-07-29T16:00:00.000Z",
        "net_pnl_usdt": "-23.4627746535",
        "net_return": "-0.0234627746535",
        "positive_label": 0,
        "confirmatory_eligible": false,
        "all_stream_inclusion_required": true
      }
    },
    "trial_binding": {
      "const": {
        "trial_family": "baseline-rule-challenger-2026q3",
        "challenger_policy_id": "SPOT_LONG_SMA20_COST_MARGIN_MOMENTUM_V2",
        "policy_hash": "2ef83c7c73fff8b163d9bad8527921bd0d87e60595680236e936254536c800e4",
        "hypothesis_registration_hash": "885b33d3a91eae1d5822fe12c16773a446c23e702f9a4110ef32f474157fa27f",
        "release_route": "BASELINE_ONLY",
        "direction": "LONG",
        "venue": "BINANCE_SPOT",
        "primary_endpoint": "GROWTH"
      }
    },
    "cohort": {
      "const": {
        "start_inclusive": "2026-07-30T12:00:00.000Z",
        "end_exclusive": "2026-10-28T12:00:00.000Z",
        "duration_days": 90,
        "slot_cadence_seconds": 14400,
        "maximum_episode_hours": 24,
        "observation_tail_end": "2026-10-29T12:00:00.000Z",
        "entry_population": "ALL_ENTER_LONG_WITH_ENTRY_SLOT_IN_HALF_OPEN_WINDOW",
        "exit_followup": "FOLLOW_TO_NATURAL_EXIT_EVEN_AFTER_END",
        "rejected_entry_treatment": "RETAIN_FOR_CONTINUITY_NOT_ECONOMIC_EPISODE",
        "episode_omission_allowed": false,
        "historical_backfill_allowed": false
      }
    },
    "measurement_binding": {
      "const": {
        "economic_plan_id": "challenger_episode_economic_plan_e5c86696889d209373ce536ee0f54be72e59d7de96b6868cd5ab0358491985a4",
        "economic_plan_hash": "fa43e1bb24ac0e9d70c82a3d09f03ca43a5f99c429f43e6c67d6e68029732831",
        "economic_plan_file_sha256": "f22cb582a7df38e14220fca75359f6290af2fdb5896e5829ba5d7fd805cf54da",
        "economic_policy_hash": "32c81160e936caf4253e0eabe46104fde5f6b747e0525fa2ea916c028dea82f9",
        "execution_minute_rule": "FIRST_WHOLE_UTC_MINUTE_STRICTLY_AFTER_DECISION_RECORDED_AT",
        "entry_source_field": "high",
        "exit_source_field": "low",
        "slippage_rate_per_side": "0.001",
        "assumed_taker_fee_rate_per_side": "0.0015",
        "reference_capital_usdt": "1000",
        "price_tick_usdt": "0.01",
        "quantity_step_eth": "0.0001",
        "decimal_arithmetic_only": true
      }
    },
    "stopping_policy": {
      "const": {
        "positive_or_negative_pnl_early_stop_allowed": false,
        "window_extension_allowed": false,
        "window_reset_allowed": false,
        "interim_profitability_pass_allowed": false,
        "interim_status": "DESCRIPTIVE_NO_EARLY_SUCCESS",
        "insufficient_evidence_status": "INCONCLUSIVE",
        "continuity_failure_status": "FAILED_CLOSED_NO_BACKFILL"
      }
    },
    "reporting_policy": {
      "const": {
        "pilot_and_confirmatory_separate_required": true,
        "all_stream_required": true,
        "positive_only_reporting_allowed": false
      }
    },
    "ai_policy": {
      "const": {
        "ai_training_in_scope": false,
        "ai_trading_authority": false,
        "baseline_must_pass_before_ai_incremental_claim": true,
        "future_ai_requires_separate_preoutcome_paired_plan": true
      }
    },
    "status": {"const": "PREREGISTERED_BEFORE_SECOND_EPISODE"},
    "authority": {
      "const": {
        "market_request_count": 0,
        "runner_invocation_count": 0,
        "broker_request_count": 0,
        "order_submission_count": 0,
        "state_write_count": 0,
        "date_override_allowed": false,
        "episode_override_allowed": false,
        "economic_override_allowed": false
      }
    },
    "eligibility": {
      "const": {
        "confirmatory_cohort": "FORWARD_COHORT_PREREGISTERED",
        "execution": "INELIGIBLE_PROXY_NOT_REAL_FILL",
        "paper": "INELIGIBLE_COLLECTION_NOT_COMPLETE",
        "profitability": "INELIGIBLE_COLLECTION_NOT_COMPLETE",
        "ai_comparison": "INELIGIBLE_NO_PAIRED_AI_COHORT"
      }
    },
    "warnings": {
      "const": [
        "KNOWN_NEGATIVE_PILOT_MUST_REMAIN_VISIBLE",
        "NO_OPTIONAL_STOPPING_OR_WINDOW_RESET",
        "INTERIM_RESULTS_CANNOT_ESTABLISH_PROFITABILITY",
        "PROXY_FILLS_ARE_NOT_REAL_EXECUTION",
        "NO_AI_ADVANTAGE_CLAIM",
        "NO_PROFITABILITY_CLAIM"
      ]
    }
  },
  "$defs": {
    "hash": {
      "type": "string",
      "pattern": "^[0-9a-f]{64}$"
    }
  }
}
