{"$schema":"./challenger-episode-cohort-plan-v1.schema.json","ai_policy":{"ai_trading_authority":false,"ai_training_in_scope":false,"baseline_must_pass_before_ai_incremental_claim":true,"future_ai_requires_separate_preoutcome_paired_plan":true},"authority":{"broker_request_count":0,"date_override_allowed":false,"economic_override_allowed":false,"episode_override_allowed":false,"market_request_count":0,"order_submission_count":0,"runner_invocation_count":0,"state_write_count":0},"cohort":{"duration_days":90,"end_exclusive":"2026-10-28T12:00:00.000Z","entry_population":"ALL_ENTER_LONG_WITH_ENTRY_SLOT_IN_HALF_OPEN_WINDOW","episode_omission_allowed":false,"exit_followup":"FOLLOW_TO_NATURAL_EXIT_EVEN_AFTER_END","historical_backfill_allowed":false,"maximum_episode_hours":24,"observation_tail_end":"2026-10-29T12:00:00.000Z","rejected_entry_treatment":"RETAIN_FOR_CONTINUITY_NOT_ECONOMIC_EPISODE","slot_cadence_seconds":14400,"start_inclusive":"2026-07-30T12:00:00.000Z"},"design_commit":"9083bf5","eligibility":{"ai_comparison":"INELIGIBLE_NO_PAIRED_AI_COHORT","confirmatory_cohort":"FORWARD_COHORT_PREREGISTERED","execution":"INELIGIBLE_PROXY_NOT_REAL_FILL","paper":"INELIGIBLE_COLLECTION_NOT_COMPLETE","profitability":"INELIGIBLE_COLLECTION_NOT_COMPLETE"},"known_pilot":{"all_stream_inclusion_required":true,"confirmatory_eligible":false,"entry_scheduled_for":"2026-07-29T00:00:00.000Z","exit_scheduled_for":"2026-07-29T16:00:00.000Z","net_pnl_usdt":"-23.4627746535","net_return":"-0.0234627746535","positive_label":0,"result_file_sha256":"8627677275c31de573f1a59f638ba1678772115dc6d932027a36e2f8b62d9fee","result_hash":"2ac4e92fa32c3841548c433590cda3fea799702fdcda291d25866db2bd993fc4","result_id":"challenger_episode_economic_result_8f2b70abf6221dc2531ecd9e6b4ada9732e8775d9673b67d4865fe7fa9b18723","role":"EXPOSED_PILOT_MANDATORY_ALL_STREAM"},"measurement_binding":{"assumed_taker_fee_rate_per_side":"0.0015","decimal_arithmetic_only":true,"economic_plan_file_sha256":"f22cb582a7df38e14220fca75359f6290af2fdb5896e5829ba5d7fd805cf54da","economic_plan_hash":"fa43e1bb24ac0e9d70c82a3d09f03ca43a5f99c429f43e6c67d6e68029732831","economic_plan_id":"challenger_episode_economic_plan_e5c86696889d209373ce536ee0f54be72e59d7de96b6868cd5ab0358491985a4","economic_policy_hash":"32c81160e936caf4253e0eabe46104fde5f6b747e0525fa2ea916c028dea82f9","entry_source_field":"high","execution_minute_rule":"FIRST_WHOLE_UTC_MINUTE_STRICTLY_AFTER_DECISION_RECORDED_AT","exit_source_field":"low","price_tick_usdt":"0.01","quantity_step_eth":"0.0001","reference_capital_usdt":"1000","slippage_rate_per_side":"0.001"},"package_baseline":"0.42.0","plan_hash":"20575f808b0e1bb4d1f26e01cd92acae59a77c1a28f28058a9d456cdabdf5201","plan_id":"challenger_episode_cohort_plan_56fa3d25d37d5445e7c29ad7cda6cd4dac622e036ee0a017c5790fb33142ab1c","registered_at":"2026-07-30T09:10:00.000Z","reporting_policy":{"all_stream_required":true,"pilot_and_confirmatory_separate_required":true,"positive_only_reporting_allowed":false},"schema_version":"1.0.0","status":"PREREGISTERED_BEFORE_SECOND_EPISODE","stopping_policy":{"continuity_failure_status":"FAILED_CLOSED_NO_BACKFILL","insufficient_evidence_status":"INCONCLUSIVE","interim_profitability_pass_allowed":false,"interim_status":"DESCRIPTIVE_NO_EARLY_SUCCESS","positive_or_negative_pnl_early_stop_allowed":false,"window_extension_allowed":false,"window_reset_allowed":false},"trial_binding":{"challenger_policy_id":"SPOT_LONG_SMA20_COST_MARGIN_MOMENTUM_V2","direction":"LONG","hypothesis_registration_hash":"885b33d3a91eae1d5822fe12c16773a446c23e702f9a4110ef32f474157fa27f","policy_hash":"2ef83c7c73fff8b163d9bad8527921bd0d87e60595680236e936254536c800e4","primary_endpoint":"GROWTH","release_route":"BASELINE_ONLY","trial_family":"baseline-rule-challenger-2026q3","venue":"BINANCE_SPOT"},"warnings":["KNOWN_NEGATIVE_PILOT_MUST_REMAIN_VISIBLE","NO_OPTIONAL_STOPPING_OR_WINDOW_RESET","INTERIM_RESULTS_CANNOT_ESTABLISH_PROFITABILITY","PROXY_FILLS_ARE_NOT_REAL_EXECUTION","NO_AI_ADVANTAGE_CLAIM","NO_PROFITABILITY_CLAIM"]}
